Shareholder,Percent,Company,shareholder_id,company_national_id,shareholder_rasmio,shareholder_national_id
شركت تامين سرمايه نوين-سهامي عام-,0.2591,رايان هم افزا,51026,10102968790,تامین سرمایه نوین,10103584900
شركت تامين سرمايه سپهر-سهامي خاص-,0.2118,رايان هم افزا,21505,10102968790,تامین سرمایه سپهر,10320708990
شركت آدورامشاور-سهامي خاص-,0.1501,رايان هم افزا,60529,10102968790,شركت آدورا مشاور,10320553884
كارگزاري تدبيرگران فردا-سهامي خاص-,0.1473,رايان هم افزا,45858,10102968790,کارگزاری تدبیرگران فردا,10861464012
صندوق سرمايه گذاري اندوخته پايدارسپهر,0.0312,رايان هم افزا,43193,10102968790,صندوق سرمایه گذاری اندوخته پایدار سپهر,10320866327
BFMصندوق.س.ا.بازارگرداني اميدلوتوس پارسيان,0.0257,رايان هم افزا,42238,10102968790,صندوق سرمایه گذاری اختصاصی بازارگردانی امیدلوتوس پارسیان,10000000055
صندوق سرمايه گذاري مشترك آتيه نوين,0.0143,رايان هم افزا,20873,10102968790,صندوق سرمایه گذاری مشترک آتیه نوین,10320791830
شركت بازرگاني همراه عرشياپارسيان-سهامي خاص-,0.1999,بيمه رازي,62838,10102425103,بازرگانی همراه عرشیا پارسیان,10104025434
شركت توسعه صدرمدائن-بامسئوليت محدود-,0.1943,بيمه رازي,45357,10102425103,توسعه صدر مداین,10320605311
شركت پيشگامان توسعه تجارت البرز-بامسئوليت محد,0.1499,بيمه رازي,45358,10102425103,پیشگامان توسعه تجارت البرز,10320410849
موسسه بنيادخيريه نيكوكاري تات,0.0691,بيمه رازي,45300,10102425103,بنیاد خیریه تات,10320780362
شركت مسكن سازان بهشت پويا-سهامي خاص-,0.0687,بيمه رازي,55130,10102425103,مسکن سازان بهشت پویا,10103916618
شركت اشراق ايمن مهرگان-بامسئوليت محدود-,0.0422,بيمه رازي,55133,10102425103,اشراق ایمن مهرگان,10104038693
شركت باغ شهرگسترايرانيان-سهامي خاص-,0.0378,بيمه رازي,45361,10102425103,باغ شهر گستر ایرانیان,10103688169
شركت گروه مالي واقتصادي آينده,0.0199,بيمه رازي,77067,10102425103,گروه مالی و اقتصادی آینده,14005933591
شركت مبين سازه بتن-سهامي خاص-,0.0116,بيمه رازي,45362,10102425103,مبین سازه بتن,10103548660
شركت سرمايه گذاري كشاورزي كوثر-سهامي عام-,0.7456,كشت وصنعت شريف آباد,517,10100721769,سرمایه گذاری کشاورزی کوثر,10100931903
BFMصندوق سرمايه گذاري اختصاصي.ب.آواي فراز,0.0155,كشت وصنعت شريف آباد,77248,10100721769,صندوق سرمایه گذاری اختصاصی بازارگردانی آوای فراز,10000000022
شركت سيمان فارس وخوزستان-سهامي عام-,0.2684,سيمان ساوه,560,10101175572,سیمان فارس و خوزستان,10100235615
شركت سرمايه گذاري سيمان تامين-سهامي عام-,0.243,سيمان ساوه,909,10101175572,سرمایه گذاری سیمان تأمین,10101942066
شركت.س.صندوق بازنشستگي كشوري-سهامي عام-,0.2123,سيمان ساوه,46034,10101175572,سرمایه گذاری صندوق بازنشستگی کشوری,10101154437
شركت گروه.م.سرمايه گذاري اميد-س.ع-,0.1535,سيمان ساوه,42186,10101175572,گروه مدیریت سرمایه گذاری امید,10102258090
شركت سرمايه گذاري سيمان اسپندار-سهامي خاص-,0.5561,سيمان‌ آرتا اردبيل,485,10240057286,سرمایه گذاری سیمان اسپندار,10103098243
شركت سرمايه گذاري وتوسعه صنايع سيمان-سهامي خاص,0.2682,سيمان‌ آرتا اردبيل,537,10240057286,سرمایه گذاری و توسعه صنایع سیمان,10102593454
شركت گروه صنايع سيمان كرمان-سهامي عام-,0.0425,سيمان‌ آرتا اردبيل,69841,10240057286,گروه صنایع سیمان کرمان,10630019476
شركت سيمان شمال-سهامي عام-,0.0295,سيمان‌ آرتا اردبيل,556,10240057286,سیمان شمال,10100246682
شخص حقیقی خارجی,0.0111,سيمان‌ آرتا اردبيل,71033,10240057286,تجارت شخص به شخص ایرانیان,14004762660
شركت سرمايه گذاري تامين اجتماعي-سهامي عام-,0.3224,سرمايه گذاري صدرتامين,447,10101924696,سرمایه گذاری تأمین اجتماعی,10101044869
شركت سرمايه گذاري صباتامين-سهامي عام-,0.2514,سرمايه گذاري صدرتامين,490,10101924696,سرمایه گذاری صباتأمین,10101908370
شركت سرمايه گذاري نفت وگازوپتروشيمي تامين-س.ع,0.1576,سرمايه گذاري صدرتامين,20203,10101924696,سرمایه گذاری نفت و گاز و پتروشیمی تامین,10420205695
موسسه صندوق بيمه اجتماعي روستائيان وعشاير,0.0556,سرمايه گذاري صدرتامين,771,10101924696,مؤسسه صندوق بیمه اجتماعی روستاییان و عشایر,10100625070
BFMصندوق.س.ا.ب.صباگسترنفت وگازتامين,0.0186,سرمايه گذاري صدرتامين,50909,10101924696,صندوق سرمایه گذاری اختصاصی بازارگردانی صبا گستر نفت و گاز تامین,10000000054
صندوق سرمايه گذاري توسعه تعاون صبا,0.0169,سرمايه گذاري صدرتامين,42057,10101924696,صندوق سرمايه گذاري توسعه تعاون صبا,14005366129
موسسه اندوخته شاهد,0.6222,سرمايه‌ گذاري‌ شاهد,756,10100986880,اندوخته شاهد,10100567400
بانك دي-سهامي عام-,0.0459,سرمايه‌ گذاري‌ شاهد,7429,10100986880,بانک دی,10320237706
BFMصندوق سرمايه گذاري.ا.بازارگرداني معيار,0.0146,سرمايه‌ گذاري‌ شاهد,60500,10100986880,اختصاصی بازارگردانی معیار,14008632146
شركت بازرگاني مباركه-سهامي خاص-,0.0108,سرمايه‌ گذاري‌ شاهد,69559,10100986880,بازرگانی مبارکه,10100941186
بانك صادرات ايران,0.7458,سرمايه گذاري گروه سپهرصادرات,63,14004518505,بانک صادرات ایران,10861736062
IFMصندوق س.ا.بازارگرداني سپهربازارسرمايه,0.1892,سرمايه گذاري گروه سپهرصادرات,62720,14004518505,صندوق سرمایه گذاری اختصاصی بازارگردانی سپهر بازار سرمایه,10000000074
شركت سرمايه گذاري هامون كيش-سهامي خاص-,0.1766,سرمايه گذاري ساختمان ايران,22631,10101660410,سرمایه گذاری هامون کیش,10861532539
شركت گروه توسعه مالي مهرآيندگان-سهامي عام-,0.146,سرمايه گذاري ساختمان ايران,21630,10101660410,گروه توسعه مالی مهر آیندگان,10101638604
شركت بانك اقتصادنوين-سهامي عام-,0.0797,سرمايه گذاري ساختمان ايران,7293,10101660410,بانک اقتصاد نوین,10102194601
شركت سرمايه گذاري صنايع پتروشيمي-سهامي عام-,0.0773,سرمايه گذاري ساختمان ايران,46165,10101660410,سرمایه گذاری صنایع پتروشیمی,10101336320
شركت سرمايه گذاري مهرگان تامين پارس-سهامي خاص-,0.0434,سرمايه گذاري ساختمان ايران,44417,10101660410,سرمایه گذاری مهرگان تامین پارس,10103460290
شركت سرمايه گذاري ساختمان نوين-سهامي عام-,0.0412,سرمايه گذاري ساختمان ايران,471,10101660410,سرمایه گذاری ساختمان نوین,10102680599
شركت مديريت سرمايه گذاري كوثربهمن-سهامي خاص-,0.0394,سرمايه گذاري ساختمان ايران,684,10101660410,مدیریت سرمایه گذاری کوثر بهمن,10100945346
صندوق سرمايه گذاري امين آشناايرانيان,0.0385,سرمايه گذاري ساختمان ايران,42125,10101660410,صندوق سرمایه گذاری امین آشنا ایرانیان,10320752394
شركت سرمايه گذاري سايه گسترسرمايه-سهامي خاص-,0.0171,سرمايه گذاري ساختمان ايران,7666,10101660410,سرمایه گذاری سایه گستر سرمایه,10103679146
شركت سرمايه گذاري امين توان آفرين ساز-س.ع-,0.0154,سرمايه گذاري ساختمان ايران,60416,10101660410,سرمایه گذاری امین توان آفرین ساز,14003873330
شركت خدمات صباتجارت ياس-سهامي خاص-,0.012,سرمايه گذاري ساختمان ايران,60594,10101660410,خدمات صبا تجارت یاس,10320847790
شركت سرمايه گذاري پويش صالحين-سهامي خاص-,0.0654,بانك قرض الحسنه رسالت,45365,10320730277,سرمایه گذاری پویش صالحین,10860094545
بنيادخيريه فرهنگي وتربيتي حاج علي اكبرصنعتي,0.012,بانك قرض الحسنه رسالت,45367,10320730277,بنیاد خیریه فرهنگی و تربیتی حاج علی اکبر صنعتی,10630000133
شركت سرمايه گذاري ملي ايران-سهامي عام-,0.1851,صنعتي‌ آما,527,10100322690,سرمایه گذاری ملی ایران,10100686779
شركت گروه سرمايه گذاري تدبير-سهامي عام-,0.1484,صنعتي‌ آما,70677,10100322690,گروه سرمایه گذاری تدبیر,10101907666
شركت مديريت سرمايه گذاري ملي ايران-سهامي خاص-,0.0668,صنعتي‌ آما,685,10100322690,مدیریت سرمایه گذاری ملی ایران,10103195710
شركت بنيادسرور,0.038,صنعتي‌ آما,7603,10100322690,موسسه بنیاد نیکوکاری سرور,10100193272
صندوق بازنشستگي كشوري,0.4932,سرمايه گذاري صندوق بازنشستگي,730,10101154437,بازرگانی صندوق بازنشستگی کشوری,10861519331
شركت سرمايه گذاري آتيه صبا-سهامي خاص-,0.0298,سرمايه گذاري صندوق بازنشستگي,788,10101154437,سرمایه گذاری آتیه صبا,10103137408
شركت بيمه مركزي جمهوري اسلامي ايران,0.0236,سرمايه گذاري صندوق بازنشستگي,21614,10101154437,بیمه مرکزی جمهوری اسلامی ایران,14001907528
موسسه صندوق بيمه اجتماعي روستائيان وعشاير,0.0186,سرمايه گذاري صندوق بازنشستگي,771,10101154437,مؤسسه صندوق بیمه اجتماعی روستاییان و عشایر,10100625070
شركت خدمات گسترصباانرژي-سهامي خاص-,0.0126,سرمايه گذاري صندوق بازنشستگي,44867,10101154437,خدمات گستر صبا انرژی,10103143373
موسسه صندوق بازنشستگي شركت ملي صنايع مس ايران,0.5223,سرمايه گذاري مس سرچشمه,770,10860513778,صندوق بازنشستگی شرکت ملی صنایع مس ایران,10630025764
شركت سرمايه گذاري راهيان سهام-سهامي خاص-,0.0433,سرمايه گذاري مس سرچشمه,51131,10860513778,سرمایه گذاری راهیان سهام,14004005812
شركت مهندسي وساخت فرآوري صنايع غيرآهني مفرغ ساز,0.0294,سرمايه گذاري مس سرچشمه,70900,10860513778,مهندسی و ساخت فرآوری صنایع غیر آهنی مفرغ ساز,10630108711
شركت سرمايه گذاري آتيه انديشان مس-سهامي عام-,0.0218,سرمايه گذاري مس سرچشمه,413,10860513778,سرمایه گذاری آتیه اندیشان مس,10102835234
شركت س.گروه مالي كيميامس ايرانيان-س.خ-,0.0147,سرمايه گذاري مس سرچشمه,70530,10860513778,سرمایه گذاری گروه مالي كيميا مس ايرانيان,10000000086
شركت توسعه صنعتي آرين-سهامي خاص-,0.6821,مجتمع سيمان غرب آسيا,51155,10380425043,توسعه صنعتی آرین,14005432147
شركت نيكان سرشت سرزمين ايرانيان-سهامي خاص-,0.0735,مجتمع سيمان غرب آسيا,62559,10380425043,نیکان سرشت سرزمین ایرانیان,14008157950
شركت پاك انرژي نيكوگستر-سهامي خاص-,0.0378,مجتمع سيمان غرب آسيا,60539,10380425043,پاک انرژی نیکو گستر,14006600422
BFMصندوق سرمايه گذاري.ا.ب.افتخارحافظ,0.018,مجتمع سيمان غرب آسيا,55155,10380425043,صندوق سرمایه گذاری اختصاصی بازارگردانی افتخار حافظ,10000000029
شركت توسعه تجارت داتام-سهامي خاص-,0.0138,مجتمع سيمان غرب آسيا,44822,10380425043,توسعه تجارت داتام,10320430282
شركت بيمه آرمان-سهامي عام-,0.0129,مجتمع سيمان غرب آسيا,22152,10380425043,بیمه آرمان,10320718237
شركت گروه بهمن-سهامي عام-,0.2542,سرمايه‌گذاري‌بهمن‌,641,10102341535,گروه بهمن,10100231402
شركت سرمايه گذاري سامان مجد-سهامي خاص-,0.1625,سرمايه‌گذاري‌بهمن‌,475,10102341535,سرمایه گذاری سامان مجد,10102844772
شركت بيمه ملت-سهامي عام-,0.0999,سرمايه‌گذاري‌بهمن‌,299,10102341535,بیمه ملت,10102526951
صندوق سرمايه گذاري اعتمادآفرين پارسيان,0.0808,سرمايه‌گذاري‌بهمن‌,41983,10102341535,صندوق سرمايه گذاری اعتماد آفرين پارسيان,14004756202
صندوق سرمايه گذاري لوتوس پارسيان,0.0808,سرمايه‌گذاري‌بهمن‌,21441,10102341535,صندوق سرمایه گذاری لوتوس پارسیان,10320823442
شركت گروه انرژي مهستان-سهامي عام-,0.0474,سرمايه‌گذاري‌بهمن‌,1000,10102341535,گروه انرژی مهستان,10103194757
بانك سپه,0.0413,سرمايه‌گذاري‌بهمن‌,52,10102341535,بانک سپه,10862064732
شركت كيامهستان-سهامي عام-,0.0361,سرمايه‌گذاري‌بهمن‌,17201,10102341535,کیا مهستان,10103138768
شركت بهمن ديزل-سهامي عام-,0.0312,سرمايه‌گذاري‌بهمن‌,60533,10102341535,بهمن دیزل,10102571964
BFMصندوق سرمايه گذاري.ا.بازارگرداني بهمن گست,0.0279,سرمايه‌گذاري‌بهمن‌,42046,10102341535,صندوق سرمایه گذاری اختصاصی بازارگردانی بهمن گست,10000000046
شركت سرمايه گذاري مانانوين-سهامي عام-,0.0127,سرمايه‌گذاري‌بهمن‌,41684,10102341535,سرمایه گذاری مانا نوین,10102803205
شركت بازرگاني تداركات كارآمدپوياابريشم-سهام,0.0112,سرمايه‌گذاري‌بهمن‌,42224,10102341535,بازرگانی تدارکات کارآمد پویا ابریشم,10320285935
شركت بيمه معلم-سهامي عام-,0.0109,سرمايه‌گذاري‌بهمن‌,1020,10102341535,بیمه معلم,10101541927
شركت صافولابهشهر-سهامي خاص-,0.7989,صنعتي‌ بهشهر,573,10100218034,صافولا بهشهر,10102550662
شركت سرمايه گذاري پارس توشه-سهامي عام-,0.0182,صنعتي‌ بهشهر,442,10100218034,سرمایه گذاری پارس توشه,10100782085
شركت سيمان فارس وخوزستان-سهامي عام-,0.5058,سيمان‌ بهبهان‌,560,10420111121,سیمان فارس و خوزستان,10100235615
شركت سيمان قاين,0.1713,سيمان‌ بهبهان‌,561,10420111121,سیمان قاین,10100917154
شركت گروه توسعه مالي مهرآيندگان-سهامي عام-,0.0793,سيمان‌ بهبهان‌,21630,10420111121,گروه توسعه مالی مهر آیندگان,10101638604
شركت سيمان سپاهان-سهامي عام-,0.0101,سيمان‌ بهبهان‌,555,10420111121,سیمان سپاهان,10260259140
شركت سيمان فارس وخوزستان-سهامي عام-,0.4032,سيمان‌ بجنورد,560,10101013009,سیمان فارس و خوزستان,10100235615
شركت گروه.م.سرمايه گذاري اميد-س.ع-,0.3125,سيمان‌ بجنورد,42186,10101013009,گروه مدیریت سرمایه گذاری امید,10102258090
شركت صنايع سيمان غرب-سهامي عام-,0.1064,سيمان‌ بجنورد,583,10101013009,صنایع سیمان غرب,10660015738
شركت سرمايه گذاري ملي ايران-سهامي عام-,0.0207,سيمان‌ بجنورد,527,10101013009,سرمایه گذاری ملی ایران,10100686779
شركت سرمايه گذاري توسعه گوهران اميد-سهامي عام-,0.0129,سيمان‌ بجنورد,48178,10101013009,سرمایه گذاری توسعه گوهران امید,10102823179
شركت سنجش سهام سيمان سبزوار-سهامي خاص-,0.0125,سيمان لار سبزوار,7377,10380131896,سنجش سهام سیمان سبزوار,10380148980
BFMصندوق سرمايه گذاري.ا.بازارگرداني معيار,0.0109,سيمان لار سبزوار,60500,10380131896,اختصاصی بازارگردانی معیار,14008632146
شركت سرمايه گذاري سپه-سهامي عام-,0.1692,سيمان‌ داراب‌,478,10101134554,سرمایه گذاری سپه,10101296740
شركت سرمايه گذاري وتوسعه صنايع سيمان-سهامي خاص,0.0545,سيمان‌ داراب‌,537,10101134554,سرمایه گذاری و توسعه صنایع سیمان,10102593454
شركت سيمان شمال-سهامي عام-,0.0498,سيمان‌ داراب‌,556,10101134554,سیمان شمال,10100246682
شركت سرمايه گذاري سايه گسترسرمايه-سهامي خاص-,0.0415,سيمان‌ داراب‌,7666,10101134554,سرمایه گذاری سایه گستر سرمایه,10103679146
شركت س اخراسان رضوي س.خ-م ك م ف ع-,0.0277,سيمان‌ داراب‌,1065,10101134554,سرمایه گذاری سهام عدالت استان خراسان رضوی,10380430077
شركت س اتهران س.خ-م ك م ف ع-,0.027,سيمان‌ داراب‌,1064,10101134554,سرمایه گذاری استان تهران,10103191091
شركت س افارس س.خ-م ك م ف ع-,0.0208,سيمان‌ داراب‌,2674,10101134554,سرمایه گذاری استان فارس,10530320996
شركت س اخوزستان س.خ-م ك م ف ع-,0.0203,سيمان‌ داراب‌,2662,10101134554,سرمایه گذاری استان خوزستان,10860903365
شركت سيمان مازندران-سهامي عام-,0.02,سيمان‌ داراب‌,70461,10101134554,سیمان مازندران,10100665220
شركت س ااصفهان س.ع-م ك م ف ع-,0.0183,سيمان‌ داراب‌,1063,10101134554,سرمایه گذاری استان اصفهان,10260490269
شركت س اآذربايجان شرقي س.خ-م ك م ف ع-,0.0161,سيمان‌ داراب‌,2663,10101134554,سرمایه گذاری استان آذربایجان شرقی,10200258715
شركت آينده سازان صنعت سيمان-سهامي خاص-,0.0153,سيمان‌ داراب‌,22167,10101134554,آینده سازان صنعت سیمان,10320814677
شركت س امازندران س.خ-م ك م ف ع-,0.0149,سيمان‌ داراب‌,2675,10101134554,سرمایه گذاری استان مازندران,10760345687
شركت س اكرمان س.خ-م ك م ف ع-,0.0139,سيمان‌ داراب‌,2665,10101134554,سرمایه گذاری استان کرمان,10630135824
شركت س اآذربايجان غربي س.خ-م ك م ف ع-,0.0125,سيمان‌ داراب‌,2676,10101134554,سرمایه گذاری استان آذربایجان غربی,10220124165
شركت س اسيستان وبلوچستان س.خ-م ك م ف ع-,0.0125,سيمان‌ داراب‌,2667,10101134554,سرمایه گذاری استان سیستان و بلوچستان,10860405350
شركت س اگيلان س.خ-م ك م ف ع-,0.0118,سيمان‌ داراب‌,2666,10101134554,سرمایه گذاری استان گیلان,10720243977
شركت انرژي گسترسينا-سهامي خاص-,0.51,صنعتي دوده فام,1021,10102837099,ارتباط گسترسینا,10102193385
شركت پالايش قطران ذغالسنگ-سهامي خاص-,0.16,صنعتي دوده فام,51955,10102837099,پالایش قطران ذغال سنگ,10101172069
بنيادمستضعفان انقلاب اسلامي,0.1177,صنعتي دوده فام,86,10102837099,بنیاد مستضعفان انقلاب اسلامی,10100171920
شركت بيمه كارآفرين,0.0102,صنعتي دوده فام,298,10102837099,بیمه کارآفرین,10102425969
شركت ذوب ونوردچهلستون سپاهان-سهامي خاص-,0.6605,گروه‌صنعتي‌سديد,7307,10100456884,ذوب ونورد چهل ستون سپاهان,10102976337
شركت سرمايه گذاري سديدتدبير-سهامي خاص-,0.026,گروه‌صنعتي‌سديد,480,10100456884,سرمایه گذاری سدید تدبیر,10101426793
بانك سامان-سهامي عام-,0.0133,گروه‌صنعتي‌سديد,51,10100456884,بانک سامان,10101972093
شركت ستاره سفيران آينده-سهامي خاص-,0.1209,سايپا ديزل,44856,10100405629,ستاره سفیران آینده,10103748245
شركت واسپاري توسعه گستربرنا-سهامي خاص-,0.113,سايپا ديزل,54954,10100405629,واسپاری توسعه گستر برنا,10101835127
شركت توسعه سرمايه رادين-سهامي خاص-,0.1043,سايپا ديزل,7424,10100405629,توسعه سرمایه رادین,10102058370
شركت تجارت الكترونيك خودروتابان تاخت-سهامي خا,0.0449,سايپا ديزل,44857,10100405629,تجارت الکترونیک خودرو تابان تاخت,10320396348
شركت راهبران سرمايه كوير-سهامي خاص-,0.0145,سايپا ديزل,60684,10100405629,راهبران سرمایه کویر,14009065460
شركت توليدي فولادسپيدفراب كوير-سهامي خاص-,0.0118,سايپا ديزل,60451,10100405629,تولیدی فولاد سپید فراب کویر,10102054719
شركت سيمان فارس وخوزستان-سهامي عام-,0.3383,سيمان‌ دورود,560,10740026271,سیمان فارس و خوزستان,10100235615
BFMصندوق.س.ا.ب.صباگسترنفت وگازتامين,0.048,سيمان‌ دورود,50909,10740026271,صندوق سرمایه گذاری اختصاصی بازارگردانی صبا گستر نفت و گاز تامین,10000000054
شركت سرمايه گذاري رستازر-سهامي خاص-,0.0233,سيمان‌ دورود,71183,10740026271,سرمایه گذاری رستا زر,14010295408
شركت سرمايه گذاري دستاورددي-سهامي خاص-,0.0132,سيمان‌ دورود,19492,10740026271,سرمایه گذاری دستاورد دی,10320225864
شركت شهريارمهستان-سهامي عام-,0.0878,صنعتي‌ دريايي‌ ايران‌,570,10101012980,شهریار مهستان,10103045588
شركت مهندسي پتروتدبيرپارس-سهامي خاص-,0.0757,صنعتي‌ دريايي‌ ايران‌,45042,10101012980,مهندسی پترو تدبیر پارس,10320364323
شركت توسعه سرمايه وصنعت غدير-سهامي عام-,0.3989,صنايع سيمان دشتستان,340,10101336603,توسعه سرمایه و صنعت غدیر,10101788597
شركت سيمان داراب-سهامي عام-,0.1612,صنايع سيمان دشتستان,553,10101336603,سیمان داراب,10101134554
شركت سيمان سپاهان-سهامي عام-,0.1005,صنايع سيمان دشتستان,555,10101336603,سیمان سپاهان,10260259140
شركت س اتهران س.خ-م ك م ف ع-,0.0195,صنايع سيمان دشتستان,1064,10101336603,سرمایه گذاری استان تهران,10103191091
شركت س اخراسان رضوي س.خ-م ك م ف ع-,0.0188,صنايع سيمان دشتستان,1065,10101336603,سرمایه گذاری سهام عدالت استان خراسان رضوی,10380430077
شركت س افارس س.خ-م ك م ف ع-,0.0141,صنايع سيمان دشتستان,2674,10101336603,سرمایه گذاری استان فارس,10530320996
شركت س اخوزستان س.خ-م ك م ف ع-,0.0138,صنايع سيمان دشتستان,2662,10101336603,سرمایه گذاری استان خوزستان,10860903365
شركت س ااصفهان س.ع-م ك م ف ع-,0.0124,صنايع سيمان دشتستان,1063,10101336603,سرمایه گذاری استان اصفهان,10260490269
شركت س اآذربايجان شرقي س.خ-م ك م ف ع-,0.011,صنايع سيمان دشتستان,2663,10101336603,سرمایه گذاری استان آذربایجان شرقی,10200258715
