Shareholder,Percent,Company,shareholder_id,company_national_id,shareholder_rasmio,shareholder_national_id
شركت سام گروه-سهامي خاص-,0.0433,بيمه زندگي خاورميانه,2910,14006444985,سام گروه,10102417191
شركت آسفالت طوس-سهامي خاص-,0.0433,بيمه زندگي خاورميانه,50432,14006444985,آسفالت طوس,10861678539
شركت كياآساتجارت توس-سهامي خاص-,0.0433,بيمه زندگي خاورميانه,70168,14006444985,کیا آسا تجارت توس,10380474989
BFMصندوق س.اختصاصي بازارگرداني پاداش.پ.پ,0.0196,بيمه زندگي خاورميانه,60374,14006444985,اختصاصی بازارگردانی پاداش پشتیبان پارس,14008473366
شركت تامين خدمات ساويس مايا-سهامي خاص-,0.0172,بيمه زندگي خاورميانه,50414,14006444985,تامین خدمات ساویس مایا,14007679369
شركت.س.ت.سامانه هاي رايانه اي هوپادهوناميك س خ,0.0166,بيمه زندگي خاورميانه,60350,14006444985,سرمایه گذاری تجاری سامانه های رایانه ای هوپاد هونامیک,14008036097
شركت سرمايه گذاري دارويي بهيان پرمون-سهامي خاص,0.0164,بيمه زندگي خاورميانه,51024,14006444985,سرمایه گذاری دارویی بهیان پرمون,14007982406
شركت بازرگاني طرح وانديشه آتيه-سهامي خاص-,0.0112,بيمه زندگي خاورميانه,55029,14006444985,بازرگانی طرح و اندیشه آتیه,10102839981
شركت آتيه پگاه-سهامي خاص-,0.0112,بيمه زندگي خاورميانه,46086,14006444985,آتیه پگاه,10102486971
شركت تكادو-سهامي عام-,0.4005,معادن‌منگنزايران‌,334,10860958854,تکادو,10260289240
شركت مجتمع نگين معادن احياء-سهامي خاص-,0.0976,معادن‌منگنزايران‌,60420,10860958854,مجتمع نگین معادن احیاء,10260444635
شركت سرمايه گذاري صنايع شيميايي ايران-سهامي عا,0.0546,معادن‌منگنزايران‌,20162,10860958854,سرمایه گذاری صنایع شیمیایی ایران,10100970248
شركت تارابگين-سهامي خاص-,0.026,معادن‌منگنزايران‌,47179,10860958854,تارابگین,10860115128
BFMصندوق س.ا.بازارگرداني آرمان تدبيرنقش جهان,0.0165,معادن‌منگنزايران‌,70031,10860958854,صندوق سرمایه گذاری اختصاصی بازارگردانی آرمان تدبیر نقش جهان,10000000020
شركت صنعتي مينو-سهامي عام-,0.3006,شركت صنايع غذايي مينو شرق,21451,10860251887,صنعتی مینو,10460002140
شركت پارس گسترمينو-سهامي خاص-,0.2913,شركت صنايع غذايي مينو شرق,42080,10860251887,پارس گستر مینو,10103919380
شركت توسعه كسب وكارفاخر-سهامي خاص-,0.0167,شركت صنايع غذايي مينو شرق,77261,10860251887,توسعه کسب و کار فاخر,14011061967
شركت قاسم ايران-سهامي عام-,0.0123,شركت صنايع غذايي مينو شرق,46101,10860251887,قاسم ایران,10100984757
شركت اقتصادي وخودكفايي آزادگان-سهامي خاص-,0.01,شركت صنايع غذايي مينو شرق,253,10860251887,اقتصادی و خودکفایی آزادگان,10100353165
شركت توليدي موتورگيربكس واكسل سايپا-سهامي خاص,0.1581,مهندسي‌نصيرماشين‌,362,10260132760,تولیدی موتور گیربکس واکسل سایپا,10101336071
شركت سرمايه تجارت ساتراس-سهامي خاص-,0.0273,مهندسي‌نصيرماشين‌,60885,10260132760,سرمایه تجارت ساتراس,14009155370
شركت ايلياسرمايه پيشرو-سهامي خاص-,0.0195,مهندسي‌نصيرماشين‌,60566,10260132760,ایلیا سرمایه پیشرو,14008409034
شركت مدرن تجارت اسپرلوس-سهامي خاص-,0.0104,مهندسي‌نصيرماشين‌,69687,10260132760,مدرن تجارت اسپرلوس,14009485470
شركت صنايع پتروشيمي خليج فارس-سهامي عام-,0.8259,مبين انرژي خليج فارس,22175,10320055865,صنایع پتروشیمی خلیج فارس,10101336301
شركت توسعه ومديريت سرمايه صبا-سهامي خاص-,0.0164,مبين انرژي خليج فارس,22650,10320055865,توسعه و مدیریت سرمایه صبا,14003923256
شركت بيمه مركزي جمهوري اسلامي ايران,0.0161,مبين انرژي خليج فارس,21614,10320055865,بیمه مرکزی جمهوری اسلامی ایران,14001907528
BFMصندوق سرمايه گذاري.ا.ب.خليج فارس,0.0116,مبين انرژي خليج فارس,60391,10320055865,صندوق سرمایه گذاری اختصاصی بازارگردانی خلیج فارس,10000000038
شركت گسترش الكترونيك تدبيرايران-سهامي خاص-,0.1847,مبين وان كيش,71449,10980196817,گسترش الکترونیک تدبیر ایران,10103492170
شركت سرمايه گذاري مهرگان سرمايه پارس-سهامي عام,0.1327,مبين وان كيش,60357,10980196817,سرمایه گذاری مهرگان سرمایه پارس,10102898876
شركت سرمايه گذاري ملي ايران-سهامي عام-,0.0912,مبين وان كيش,527,10980196817,سرمایه گذاری ملی ایران,10100686779
شركت سرمايه گذاري راستين ارزش سپهر-سهامي عام-,0.0759,مبين وان كيش,69919,10980196817,سرمایه گذاری راستین ارزش سپهر,10102898857
موسسه غيرتجاري دانش بنيان بركت,0.0495,مبين وان كيش,62677,10980196817,مؤسسه دانش بنیان برکت,14005828941
شركت سرمايه گذاري سايه گسترسرمايه-سهامي خاص-,0.0316,مبين وان كيش,7666,10980196817,سرمایه گذاری سایه گستر سرمایه,10103679146
شركت سرمايه گذاري آتيه مداران-سهامي خاص-,0.0184,مبين وان كيش,26483,10980196817,سرمایه گذاری آتیه مداران,10320692094
شركت سرمايه گذاري سامان مجد-سهامي خاص-,0.0168,مبين وان كيش,475,10980196817,سرمایه گذاری سامان مجد,10102844772
PRXسبد-شرك61630--شرك17671-,0.012,مبين وان كيش,71341,10980196817,مسیر سبز فرادیس,10103259555
شركت سرمايه گذاري آوانوين-سهامي عام-,0.0115,مبين وان كيش,51980,10980196817,سرمایه گذاری آوا نوین,10102836862
شركت سرمايه گذاري پويا-سهامي عام-,0.0108,مبين وان كيش,44289,10980196817,سرمایه گذاری پویا,10102588528
شركت گروه مالي ملت-سهام عام-,0.92,سرمايه گذاري توسعه معين ملت,8113,10320359435,گروه مالی ملت,10102801942
شركت بهسازمشاركتهاي ملت-سهامي عام-,0.01,سرمايه گذاري توسعه معين ملت,34001,10320359435,بهساز مشارکت های ملت,10101165910
شركت چاپ بانك ملت,0.01,سرمايه گذاري توسعه معين ملت,33996,10320359435,چاپ بانک ملت,10100905654
شركت ساختمان وخدمات نوساز-سهامي خاص-,0.01,سرمايه گذاري توسعه معين ملت,33997,10320359435,ساختمان و خدمات نوساز,10100509097
شركت ساختماني بانك ملت-سهامي خاص-,0.01,سرمايه گذاري توسعه معين ملت,33998,10320359435,ساختمانی بانک ملت,10101150400
شركت طرح وانديشه بهسازملت-سهامي خاص-,0.01,سرمايه گذاري توسعه معين ملت,33999,10320359435,طرح و اندیشه بهساز ملت,10103303665
شركت ساختماني وشهرسازي واوان-سهامي خاص-,0.01,سرمايه گذاري توسعه معين ملت,34000,10320359435,ساختمانی و شهرسازی واوان,10100711614
شركت پتروفرآوران اطلس-سهامي خاص-,0.01,سرمايه گذاري توسعه معين ملت,34002,10320359435,پترو فرآوران اطلس,10000000079
كارگزاري بانك ملت,0.01,سرمايه گذاري توسعه معين ملت,2684,10320359435,کارگزاری بانک ملت,10101443196
شركت سرمايه گذاري كشتيراني جمهوري اسلامي ايران,0.2,بيمه معلم,7640,10101541927,سرمایه گذاری کشتیرانی جمهوری اسلامی ایران,10102234877
شركت سرمايه گذاري فرهنگيان-سهامي خاص-,0.177,بيمه معلم,515,10101541927,سرمایه گذاری فرهنگیان,10101380313
شركت بانك سرمايه-سهامي عام-,0.1696,بيمه معلم,19397,10101541927,بانک سرمایه,10103798457
شركت سرمايه گذاري راستين نوين كيش-سهامي خاص-,0.0769,بيمه معلم,50287,10101541927,سرمایه گذاری راستین نوین کیش,10980192642
شركت كشتيراني اقيانوس خروشان كيش-سهامي خاص-,0.0737,بيمه معلم,50286,10101541927,کشتیرانی اقیانوس خروشان کیش,10980194380
شركت سرمايه گذاري سايه گسترسرمايه-سهامي خاص-,0.0318,بيمه معلم,7666,10101541927,سرمایه گذاری سایه گستر سرمایه,10103679146
شركت بين المللي توسعه صنايع ومعادن غدير-سهامي خ,0.4234,موتوژن‌,42025,10200062838,بین المللی توسعه صنایع و معادن غدیر,10320585987
شركت سرمايه گذاري آذر-سهامي خاص-,0.1039,موتوژن‌,415,10200062838,سرمایه گذاری آذر,10103837742
شركت گروه توسعه اقتصادملل-سهامي خاص-,0.0554,موتوژن‌,45451,10200062838,گروه توسعه اقتصاد ملل,10320352137
موسسه صندوق بيمه اجتماعي روستائيان وعشاير,0.0144,موتوژن‌,771,10200062838,مؤسسه صندوق بیمه اجتماعی روستاییان و عشایر,10100625070
شركت ذوب آهن آريان بوئين زهرا-بامسئوليت محدود-,0.0117,موتوژن‌,60513,10200062838,ذوب آهن آریان بویین زهرا,10103875392
شركت نوردآريان فولاد-سهامي خاص-,0.1035,ماشين‌آلات صنعتي تراكتورسازي‌,706,10200115133,نورد آریان فولاد,10102240975
شركت گروه مپنا-سهامي عام-,0.999,مديريت نيروگاهي ايرانيان مپنا,41841,14005921810,گروه مپنا,10101431259
شركت گروه سرمايه گذاري مسكن-سهامي عام-,0.7607,سرمايه گذاري مسكن پرديس,22188,10103122715,گروه سرمایه گذاری مسکن,10101236571
شركت مكين-سهامي خاص-,0.0511,توليدي‌مهرام‌,42375,10100542221,مکین,10380179815
شركت دنياي فن آوران پويا-سهامي خاص-,0.0486,توليدي‌مهرام‌,972,10100542221,دنیای فن آوران پویا,10102225611
صندوق سرمايه گذاري مشترك بانك خاورميانه,0.0312,توليدي‌مهرام‌,42324,10100542221,صندوق سرمایه گذاری مشترک بانک خاورمیانه,14003902009
شركت سرمايه گذاري دنياي آزادپويا-سهامي خاص-,0.0198,توليدي‌مهرام‌,984,10100542221,سرمایه گذاری دنیای آزاد پویا,10102278837
شركت داروتجارت سامان-سهامي خاص-,0.0153,توليدي‌مهرام‌,386,10100542221,دارو تجارت سامان,10102229288
صندوق سرمايه گذاري بانك ايران زمين,0.014,توليدي‌مهرام‌,42010,10100542221,صندوق سرمایه گذاری بانک ایران زمین,10320723505
شركت توسعه نوآوران آپادانا-سهامي خاص-,0.0129,توليدي‌مهرام‌,70359,10100542221,توسعه نوآوران آپادانا,10103399243
شركت توسعه صنايع بهشهر-سهامي عام-,0.6823,مارگارين‌,1032,10100239199,توسعه صنایع بهشهر,10100539090
شركت سرمايه گذاري گروه توسعه ملي-سهامي عام-,0.0323,مارگارين‌,7497,10100239199,سرمایه گذاری گروه توسعه ملی,10101339590
BFMصندوق سرمايه گذاري.ا.ب.گروه توسعه بهشهر,0.0135,مارگارين‌,22860,10100239199,صندوق سرمایه گذاری اختصاصی بازارگردانی گروه توسعه بهشهر,10000000041
شركت گروه مالي شهر-سهامي خاص-,0.01,مارگارين‌,69787,10100239199,گروه مالی شهر,10320832748
شركت سرمايه گذاري ملي ايران-سهامي عام-,0.4252,ايران‌ مرينوس‌,527,10100470757,سرمایه گذاری ملی ایران,10100686779
بنيادمستضعفان انقلاب اسلامي,0.158,ايران‌ مرينوس‌,86,10100470757,بنیاد مستضعفان انقلاب اسلامی,10100171920
شركت گروه.م.سرمايه گذاري اميد-س.ع-,0.5039,بازرگاني و توليدي مرجان كار,42186,10700073536,گروه مدیریت سرمایه گذاری امید,10102258090
BFMصندوق سرمايه گذاري.ا.ب.گوهرفام اميد,0.0374,بازرگاني و توليدي مرجان كار,60341,10700073536,صندوق سرمایه گذاری اختصاصی بازارگردانی گوهرفام امید,10000000042
BFMصندوق.س.ا.بازارگرداني سهم آشنايكم,0.0852,ماداكتو استيل كرد,46966,10320345330,اختصاصی بازارگردانی سهم آشنا یکم,14007120347
شركت مشاورسرمايه گذاري فرازايده نوآفرين تك-س خ,0.0361,ماداكتو استيل كرد,50345,10320345330,مشاور سرمایه گذاری فراز ایده نوآفرین تک,14007219634
شركت صندوق پژوهش وفناوري غ دولتي ت فناوري نانوس خ,0.034,ماداكتو استيل كرد,50914,10320345330,صندوق پژوهش و فناوری غیر دولتی توسعه فناوری نانو,10980230751
شركت صندوق حمايت ازسرمايه گذاري زيست فناوري-سه,0.0328,ماداكتو استيل كرد,48288,10320345330,صندوق حمایت از سرمایه گذاری زیست فناوری,14005130053
شركت سرمايه گذاري وخدمات مديريت صندوق بازنشستگ,0.0235,ماداكتو استيل كرد,21538,10320345330,سرمایه گذاری و خدمات مدیریت صندوق بازنشستگی کشوری,10103584004
شركت توسعه اقتصادي اوان تهران-سهامي خاص-,0.0112,ماداكتو استيل كرد,60725,10320345330,سرمایه گذاری اوان تهران,14008582556
شركت گروه سرمايه گذاري مسكن-سهامي عام-,0.9999,سرمايه گذاري مسكن جنوب,22188,10103382392,گروه سرمایه گذاری مسکن,10101236571
شركت گروه مالي بانك مسكن-سهامي عام-,0.4576,سرمايه‌گذاري‌ مسكن‌,42103,10101236571,گروه مالی بانک مسکن,10100687843
شركت سرمايه گذاري گروه مالي سپهرصادرات-س.ع-,0.1359,سرمايه‌گذاري‌ مسكن‌,62583,10101236571,سرمایه گذاری گروه مالی سپهر صادرات,14004518505
شركت سرمايه گذاري توسعه ملي-سهامي عام-,0.0747,سرمايه‌گذاري‌ مسكن‌,461,10101236571,سرمایه گذاری توسعه ملی,10102501905
شركت گروه توسعه مالي مهرآيندگان-سهامي عام-,0.0331,سرمايه‌گذاري‌ مسكن‌,21630,10101236571,گروه توسعه مالی مهر آیندگان,10101638604
صندوق سرمايه گذاري ره آوردآبادمسكن,0.0199,سرمايه‌گذاري‌ مسكن‌,42008,10101236571,ره آورد آباد مسکن,10320863149
شركت سرمايه گذاري گروه توسعه ملي-سهامي عام-,0.0171,سرمايه‌گذاري‌ مسكن‌,7497,10101236571,سرمایه گذاری گروه توسعه ملی,10101339590
سازمان توسعه ونوسازي معادن وصنايع معدني ايران,0.1205,ملي‌ صنايع‌ مس‌ ايران‌‌,104,10100582059,سازمان توسعه و نوسازی معادن و صنایع معدنی ایران,10102158022
موسسه صندوق بازنشستگي شركت ملي صنايع مس ايران,0.0788,ملي‌ صنايع‌ مس‌ ايران‌‌,770,10100582059,صندوق بازنشستگی شرکت ملی صنایع مس ایران,10630025764
شركت سرمايه گذاري صدرتاءمين-سهامي عام-,0.0536,ملي‌ صنايع‌ مس‌ ايران‌‌,492,10100582059,سرمایه گذاری صدر تامین,10101924696
شركت سرمايه گذاري توسعه معادن وفلزات-سهامي عام,0.0307,ملي‌ صنايع‌ مس‌ ايران‌‌,460,10100582059,سرمایه گذاری توسعه معادن و فلزات,10101634157
شركت س.گروه مالي كيميامس ايرانيان-س.خ-,0.0288,ملي‌ صنايع‌ مس‌ ايران‌‌,70530,10100582059,سرمایه گذاری گروه مالي كيميا مس ايرانيان,10000000086
"موسسه صندوق بازنشستگي،وظيفه،ازكارافتادگي وپ",0.0275,ملي‌ صنايع‌ مس‌ ايران‌‌,7638,10100582059,مؤسسه صندوق بازنشستگی وظیفه از کار افتادگی و پس انداز کارکنان بانکهای ملی و ادغام شده,10103037570
شركت س اتهران س.خ-م ك م ف ع-,0.0212,ملي‌ صنايع‌ مس‌ ايران‌‌,1064,10100582059,سرمایه گذاری استان تهران,10103191091
شركت س اخراسان رضوي س.خ-م ك م ف ع-,0.0204,ملي‌ صنايع‌ مس‌ ايران‌‌,1065,10100582059,سرمایه گذاری سهام عدالت استان خراسان رضوی,10380430077
شركت واسط مالي آذرچهارم-بامسئوليت محدود-,0.0189,ملي‌ صنايع‌ مس‌ ايران‌‌,60545,10100582059,واسط مالی آذر چهارم,14008467969
شركت سرمايه گذاري آتيه صبا-سهامي خاص-,0.0179,ملي‌ صنايع‌ مس‌ ايران‌‌,788,10100582059,سرمایه گذاری آتیه صبا,10103137408
شركت سرمايه گذاري فرهنگيان-سهامي خاص-,0.0157,ملي‌ صنايع‌ مس‌ ايران‌‌,515,10100582059,سرمایه گذاری فرهنگیان,10101380313
شركت س افارس س.خ-م ك م ف ع-,0.0154,ملي‌ صنايع‌ مس‌ ايران‌‌,2674,10100582059,سرمایه گذاری استان فارس,10530320996
شركت سرمايه گذاري آتيه انديشان مس-سهامي عام-,0.0151,ملي‌ صنايع‌ مس‌ ايران‌‌,413,10100582059,سرمایه گذاری آتیه اندیشان مس,10102835234
شركت س اخوزستان س.خ-م ك م ف ع-,0.015,ملي‌ صنايع‌ مس‌ ايران‌‌,2662,10100582059,سرمایه گذاری استان خوزستان,10860903365
شركت صباميهن-سهامي خاص-,0.0138,ملي‌ صنايع‌ مس‌ ايران‌‌,48312,10100582059,صبا میهن,10101997560
شركت توسعه ومديريت سرمايه صبا-سهامي خاص-,0.0137,ملي‌ صنايع‌ مس‌ ايران‌‌,22650,10100582059,توسعه و مدیریت سرمایه صبا,14003923256
شركت س ااصفهان س.ع-م ك م ف ع-,0.0135,ملي‌ صنايع‌ مس‌ ايران‌‌,1063,10100582059,سرمایه گذاری استان اصفهان,10260490269
شركت س اآذربايجان غربي س.خ-م ك م ف ع-,0.0117,ملي‌ صنايع‌ مس‌ ايران‌‌,2676,10100582059,سرمایه گذاری استان آذربایجان غربی,10220124165
شركت س امازندران س.خ-م ك م ف ع-,0.011,ملي‌ صنايع‌ مس‌ ايران‌‌,2675,10100582059,سرمایه گذاری استان مازندران,10760345687
موسسه صندوق بيمه اجتماعي روستائيان وعشاير,0.0107,ملي‌ صنايع‌ مس‌ ايران‌‌,771,10100582059,مؤسسه صندوق بیمه اجتماعی روستاییان و عشایر,10100625070
شركت س اكرمان س.خ-م ك م ف ع-,0.0103,ملي‌ صنايع‌ مس‌ ايران‌‌,2665,10100582059,سرمایه گذاری استان کرمان,10630135824
شركت گروه توسعه مالي مهرآيندگان-سهامي عام-,0.01,ملي‌ صنايع‌ مس‌ ايران‌‌,21630,10100582059,گروه توسعه مالی مهر آیندگان,10101638604
شركت تراكتورسازي ايران-سهامي عام-,0.836,موتورسازان‌تراكتورسازي‌ايران‌,7684,10200101232,تراکتور سازی ایران,10200044047
شركت سرمايه گذاري اهداف-سهامي عام-,0.4814,سرمايه‌گذاري صنعت‌نفت‌‌,20062,10101701430,سرمایه گذاری اهداف,10103808813
شركت سرمايه گذاري تامين آتيه مسكن-سهامي خاص-,0.0252,سرمايه‌گذاري صنعت‌نفت‌‌,7591,10101701430,سرمایه گذاری تامین آتیه مسکن,10320307426
BFMصندوق سرمايه گذاري.ا.ب.خبرگان اهداف,0.0162,سرمايه‌گذاري صنعت‌نفت‌‌,62903,10101701430,صندوق سرمایه گذاری اختصاصی بازارگردانی خبرگان اهداف,10000000037
شركت گروه توسعه مالي مهرآيندگان-سهامي عام-,0.0121,سرمايه‌گذاري صنعت‌نفت‌‌,21630,10101701430,گروه توسعه مالی مهر آیندگان,10101638604
صندوق سرمايه گذاري ره آوردآبادمسكن,0.0108,سرمايه‌گذاري صنعت‌نفت‌‌,42008,10101701430,ره آورد آباد مسکن,10320863149
شركت آلومينيوم تابنده اراك-سهامي خاص-,0.3346,نورد آلومينيوم‌,48066,10100577370,آلومینیوم تابنده اراک,10780071970
شركت هوشمندسرمايه پرديس-بامسئوليت محدود-,0.1757,نورد آلومينيوم‌,51476,10100577370,هوشمند سرمایه پردیس,14007605986
شركت پيشران سرمايه پرديس-بامسئوليت محدود-,0.1716,نورد آلومينيوم‌,51475,10100577370,پیشران سرمایه پردیس,14007606005
شركت بيمه دانا-سهامي عام-,0.0124,نورد آلومينيوم‌,21815,10100577370,بیمه دانا,10100641966
شركت گروه.م.سرمايه گذاري اميد-س.ع-,0.999,توليدي مخازن گاز آسياناما,42186,10861658827,گروه مدیریت سرمایه گذاری امید,10102258090
شركت سرمايه گذاري آتيه صبا-سهامي خاص-,0.4149,مجتمع معادن مس تكنار,788,10380412012,سرمایه گذاری آتیه صبا,10103137408
شركت صدرمعادن ايرانيان-سهامي خاص-,0.2,مجتمع معادن مس تكنار,20240,10380412012,صدر معادن ایرانیان,10103884094
BFMصندوق سرمايه گذاري.ا.ب.ارزش آفرين ص.ب.ك,0.0414,مجتمع معادن مس تكنار,48390,10380412012,صندوق سرمایه گذاری اختصاصی بازارگردانی ارزش آفرین ص.ب.ک,10000000027
شركت كاوشگران بازارسرمايه-سهامي خاص-,0.0103,مجتمع معادن مس تكنار,69930,10380412012,کاوشگران بازار سرمایه,14004760805
شركت سرمايه گذاري صدرتاءمين-سهامي عام-,0.6425,فراورده‌ هاي‌ نسوزايران‌,492,10100592890,سرمایه گذاری صدر تامین,10101924696
BFMصندوق.س.ا.ب.صباگسترنفت وگازتامين,0.0111,فراورده‌ هاي‌ نسوزايران‌,50909,10100592890,صندوق سرمایه گذاری اختصاصی بازارگردانی صبا گستر نفت و گاز تامین,10000000054
شركت مهندسي ري نيرو-سهامي خاص-,0.6369,توليد نيروي برق آبادان,22154,10860410234,مهندسی ری نیرو,10102819429
شركت گروه اقتصادمفيد-سهامي خاص-,0.2135,توليد نيروي برق آبادان,22155,10860410234,گروه اقتصاد مفید,14003721057
BFMصندوق سرمايه گذاري.ا.ب.تدبيرگران فردا,0.0568,توليد نيروي برق آبادان,46036,10860410234,اختصاصی بازارگردانی تدبیرگران فردا,14006793310
بنيادمستضعفان انقلاب اسلامي,0.3003,نفت‌ بهران‌,86,10100434484,بنیاد مستضعفان انقلاب اسلامی,10100171920
شركت انرژي گسترسينا-سهامي خاص-,0.2114,نفت‌ بهران‌,1021,10100434484,ارتباط گسترسینا,10102193385
شركت گروه پتروشيمي تابان فردا-سهامي عام-,0.158,نفت‌ بهران‌,22134,10100434484,گروه پتروشیمی تابان فردا,10103804104
شركت سرمايه گذاري توسعه ملي-سهامي عام-,0.0134,نفت‌ بهران‌,461,10100434484,سرمایه گذاری توسعه ملی,10102501905
شركت پالايش نفت تهران-سهامي عام-,0.01,نفت‌ بهران‌,69993,10100434484,پالایش نفت تهران,10101874640
