Shareholder,Percent,Company,shareholder_id,company_national_id,shareholder_rasmio,shareholder_national_id
شركت پتروشيمي فن آوران-سهامي عام-,0.4802,پتروشيمي فارابي,7379,10100613721,پتروشیمی فن آوران,10101826594
شركت پتروشيمي اميركبير-سهامي عام-,0.3214,پتروشيمي فارابي,7378,10100613721,پتروشیمی امیر کبیر,10101807733
BFMصندوق.س.ا.ب.صباگسترنفت وگازتامين,0.0175,پتروشيمي فارابي,50909,10100613721,صندوق سرمایه گذاری اختصاصی بازارگردانی صبا گستر نفت و گاز تامین,10000000054
شركت مهندسي وساختمان پي چين-سهامي خاص-,0.032,صنايع فولاد آلياژي يزد,70465,10861613541,مهندسی و ساختمان پی چین,10100323770
شركت توسعه فن آوران داده پرداززرفام-سهامي خاص-,0.0263,صنايع فولاد آلياژي يزد,60795,10861613541,توسعه فن آوران داده پرداز زرفام,14007214060
BFMصندوق سرمايه گذاري.ا.ب.اكسيرسودا,0.0143,صنايع فولاد آلياژي يزد,51402,10861613541,صندوق سرمایه گذاری اختصاصی بازارگردانی اکسیرسودا,10000000030
شركت توسعه سرمايه فولادي اهوراسپيدار-س.خ-,0.0134,صنايع فولاد آلياژي يزد,70784,10861613541,توسعه سرمايه فولادی اهورا سپيدار,14010328798
شركت توسعه سرمايه رادين-سهامي خاص-,0.0117,صنايع فولاد آلياژي يزد,7424,10861613541,توسعه سرمایه رادین,10102058370
شركت مديريت سرمايه آتيه خواهان-سهامي خاص-,0.0106,صنايع فولاد آلياژي يزد,19316,10861613541,مدیریت سرمایه آتیه خواهان,10320380692
سازمان خصوصي سازي-وكالتي,0.0119,صنايع ‌بسته‌بندي‌ مشهد,109,10380190780,سازمان خصوصی سازی,14000286830
شركت سرمايه گذاري تجاري شستان-س.خ-,0.7992,فروسيليسيم خمين,908,10320605628,سرمایه گذاری تجاری شستان,10103653560
BFMصندوق سرمايه گذاري.ا.بازارگرداني مهرگان,0.1238,فروسيليسيم خمين,60652,10320605628,صندوق سرمایه گذاری اختصاصی بازارگردانی مهرگان,10000000050
شركت واسط مالي مهرپنجم-بامسئوليت محدود-,0.6762,فيبر ايران‌,70213,10100429427,واسط مالی مهر پنجم,14009747890
موسسه سازمان خيريه درماني جوادالائمه ع,0.0628,فيبر ايران‌,60410,10100429427,درمانی خیریه جوادالایمه ع,10630006709
شركت سرمايه گذاري ملي ايران-سهامي عام-,0.0297,فيبر ايران‌,527,10100429427,سرمایه گذاری ملی ایران,10100686779
شركت كشتيراني جمهوري اسلامي ايران,0.8999,كشتيراني والفجر,7683,10101050209,کشتیرانی جمهوری اسلامی ایران,10861629011
شركت سرمايه گذاري كشتيراني جمهوري اسلامي ايران,0.1,كشتيراني والفجر,7640,10101050209,سرمایه گذاری کشتیرانی جمهوری اسلامی ایران,10102234877
موسسه صندوق بيمه اجتماعي روستائيان وعشاير,0.5471,فولاد خراسان,771,10861926358,مؤسسه صندوق بیمه اجتماعی روستاییان و عشایر,10100625070
شركت سرمايه گذاري توسعه معادن وفلزات-سهامي عام,0.3297,فولاد خراسان,460,10861926358,سرمایه گذاری توسعه معادن و فلزات,10101634157
موسسه صندوق حمايت وبازنشستگي كارك.فولاد,0.0813,فولاد خراسان,22061,10861926358,صندوق حمایت وبازنشستگی کارکنان فولاد,10100395131
شركت بين المللي فولادتجارت دالاهو-سهامي خاص-,0.0225,فولاد خراسان,50202,10861926358,بین المللی فولاد تجارت دالاهو,10320691815
شركت گروه توسعه اقتصادي پايندگان-سهامي خاص-,0.4626,فولاد خوزستان,22162,10101138294,گروه توسعه اقتصادی پایندگان,10103804083
شركت سرمايه گذاري آتيه صبا-سهامي خاص-,0.0331,فولاد خوزستان,788,10101138294,سرمایه گذاری آتیه صبا,10103137408
شركت س اتهران س.خ-م ك م ف ع-,0.0172,فولاد خوزستان,1064,10101138294,سرمایه گذاری استان تهران,10103191091
شركت سرمايه گذاري سامان مجد-سهامي خاص-,0.0168,فولاد خوزستان,475,10101138294,سرمایه گذاری سامان مجد,10102844772
شركت س اخراسان رضوي س.خ-م ك م ف ع-,0.0166,فولاد خوزستان,1065,10101138294,سرمایه گذاری سهام عدالت استان خراسان رضوی,10380430077
شركت س افارس س.خ-م ك م ف ع-,0.0125,فولاد خوزستان,2674,10101138294,سرمایه گذاری استان فارس,10530320996
شركت س اخوزستان س.خ-م ك م ف ع-,0.0122,فولاد خوزستان,2662,10101138294,سرمایه گذاری استان خوزستان,10860903365
شركت سرمايه گذاري ملي ايران-سهامي عام-,0.0112,فولاد خوزستان,527,10101138294,سرمایه گذاری ملی ایران,10100686779
شركت س ااصفهان س.ع-م ك م ف ع-,0.0109,فولاد خوزستان,1063,10101138294,سرمایه گذاری استان اصفهان,10260490269
شركت يگانه انديش سرمايه-سهامي خاص-,0.3598,گروه صنايع معادن فلات ايرانيان,77350,10102849101,یگانه اندیش سرمایه,10320170526
شركت سرمايه گذاري توسعه معادن وفلزات-سهامي عام,0.0669,گروه صنايع معادن فلات ايرانيان,460,10102849101,سرمایه گذاری توسعه معادن و فلزات,10101634157
شركت نگين شفق سپهر-سهامي خاص-,0.0162,گروه صنايع معادن فلات ايرانيان,46087,10102849101,نگین شفق سپهر,10320611838
شركت سازه گسترسايپاسهامي خاص,0.4773,فنرسازي‌زر,405,10861186485,مهندسی و مشاوره سازه گستر سایپا,10101017663
شركت سرمايه گذاري گروه صنعتي رنا-سهامي عام-,0.0583,فنرسازي‌زر,522,10861186485,سرمایه گذاری گروه صنعتی رنا,10100727160
BFMصندوق.س.ا.بازارگرداني اميدلوتوس پارسيان,0.0126,فنرسازي‌زر,42238,10861186485,صندوق سرمایه گذاری اختصاصی بازارگردانی امیدلوتوس پارسیان,10000000055
صندوق رفاه وتامين آتيه,0.5624,گسترش صنايع انرژي آذرآب,42642,10780055634,رفاه وتامین اتیه امید,10100589211
شركت صنايع آذرآب-سهامي عام-,0.0988,گسترش صنايع انرژي آذرآب,21604,10780055634,صنایع آذر آب,10780042000
شركت فولادمباركه اصفهان,0.952,فولاد هرمزگان جنوب,612,10800154024,فولاد مبارکه اصفهان,10260289464
سازمان توسعه ونوسازي معادن وصنايع معدني ايران,0.1719,فولاد مباركه اصفهان,104,10260289464,سازمان توسعه و نوسازی معادن و صنایع معدنی ایران,10102158022
شركت توسعه سرمايه رفاه-سهامي خاص-,0.1024,فولاد مباركه اصفهان,47709,10260289464,سرمایه گذاری توسعه سرمایه رفاه,10320548447
بانك تجارت,0.0249,فولاد مباركه اصفهان,49,10260289464,بانک تجارت,10100834460
"موسسه صندوق بازنشستگي،وظيفه،ازكارافتادگي وپ",0.024,فولاد مباركه اصفهان,7638,10260289464,مؤسسه صندوق بازنشستگی وظیفه از کار افتادگی و پس انداز کارکنان بانکهای ملی و ادغام شده,10103037570
موسسه صندوق بيمه اجتماعي روستائيان وعشاير,0.0238,فولاد مباركه اصفهان,771,10260289464,مؤسسه صندوق بیمه اجتماعی روستاییان و عشایر,10100625070
شركت سرمايه گذاري صدرتاءمين-سهامي عام-,0.0224,فولاد مباركه اصفهان,492,10260289464,سرمایه گذاری صدر تامین,10101924696
شركت بهسازان انرژي تدبيرزنگان-سهامي خاص-,0.0189,فولاد مباركه اصفهان,48057,10260289464,بهسازان انرژی تدبیر زنگان,10460108686
شركت س اتهران س.خ-م ك م ف ع-,0.0173,فولاد مباركه اصفهان,1064,10260289464,سرمایه گذاری استان تهران,10103191091
شركت س اخراسان رضوي س.خ-م ك م ف ع-,0.0167,فولاد مباركه اصفهان,1065,10260289464,سرمایه گذاری سهام عدالت استان خراسان رضوی,10380430077
شركت س افارس س.خ-م ك م ف ع-,0.0126,فولاد مباركه اصفهان,2674,10260289464,سرمایه گذاری استان فارس,10530320996
شركت س اخوزستان س.خ-م ك م ف ع-,0.0122,فولاد مباركه اصفهان,2662,10260289464,سرمایه گذاری استان خوزستان,10860903365
شركت س ااصفهان س.ع-م ك م ف ع-,0.011,فولاد مباركه اصفهان,1063,10260289464,سرمایه گذاری استان اصفهان,10260490269
شركت گروه مديريت نيروگاهي ايرانيان مپنا-س.ع-,0.9654,صندوق سرمايه گذاري پروژه آرمان پرند مپنا,45548,10000000001,گروه مدیریت نیروگاهی ایرانیان مپنا,14005921810
صندوق سرمايه گذاري امين يكم فردا,0.0129,صندوق سرمايه گذاري پروژه آرمان پرند مپنا,44291,10000000001,صندوق سرمايه گذاري امين يكم فردا,10000000099
شركت تامين سرمايه امين-سهامي خاص-,0.0129,صندوق سرمايه گذاري پروژه آرمان پرند مپنا,21857,10000000001,تامین سرمایه امین,10103525426
شركت بورس اوراق بهادارتهران-سهامي عام-,0.2,فرابورس ايران,7847,10103749172,بورس اوراق بهادار تهران,10103225320
شركت گروه مالي ملت-سهام عام-,0.0522,فرابورس ايران,8113,10103749172,گروه مالی ملت,10102801942
شركت گروه.م.سرمايه گذاري اميد-س.ع-,0.045,فرابورس ايران,42186,10103749172,گروه مدیریت سرمایه گذاری امید,10102258090
شركت سرمايه گذاري صباتامين-سهامي عام-,0.03,فرابورس ايران,490,10103749172,سرمایه گذاری صباتأمین,10101908370
شركت سپرده گذاري مركزي اوراق بهاداروتسويه وجوه,0.025,فرابورس ايران,7848,10103749172,سپرده گذاری مرکزی اوراق بهادار و تسویه وجوه,10103800056
شركت مديريت فناوري بورس تهران-سهامي خاص-,0.025,فرابورس ايران,45162,10103749172,مدیریت فناوری بورس تهران,10101491919
شركت گروه مالي پارسيان-سهامي خاص-,0.024,فرابورس ايران,51518,10103749172,گروه مالی پارسیان,14004046372
شركت سرمايه گذاري پارس آريان-سهامي عام-,0.0151,فرابورس ايران,440,10103749172,سرمایه گذاری پارس آریان,10102347321
شركت سرمايه گذاري گروه مالي سپهرصادرات-س.ع-,0.0112,فرابورس ايران,62583,10103749172,سرمایه گذاری گروه مالی سپهر صادرات,14004518505
شركت مديريت سرمايه گذاري كوثربهمن-سهامي خاص-,0.0109,فرابورس ايران,684,10103749172,مدیریت سرمایه گذاری کوثر بهمن,10100945346
شركت تعاوني خردمندان صابرعصر,0.0109,فرابورس ايران,41706,10103749172,خردمندان صابر عصر,14003674869
كارگزاري بانك كشاورزي,0.0108,فرابورس ايران,803,10103749172,کارگزاری بانک کشاورزی,10101476080
شركت سرمايه گذاري توسعه ملي-سهامي عام-,0.01,فرابورس ايران,461,10103749172,سرمایه گذاری توسعه ملی,10102501905
شركت سرمايه گذاري سپه-سهامي عام-,0.01,فرابورس ايران,478,10103749172,سرمایه گذاری سپه,10101296740
شركت بانك آينده-سهامي عام-,0.01,فرابورس ايران,22002,10103749172,بانک آینده,10320894878
شركت گروه سرمايه گذاري تدبير-سهامي عام-,0.01,فرابورس ايران,70677,10103749172,گروه سرمایه گذاری تدبیر,10101907666
كارگزاري بانك سپه,0.01,فرابورس ايران,17239,10103749172,کارگزاری بانک سپه,10101425199
شركت كارآفرينان صنعت ذوب فلزات-سهامي خاص-,0.3674,فروسيليس‌ ايران‌,21477,10861153704,کارآفرینان صنعت ذوب فلزات,10102313396
صندوق سرمايه گذاري مشترك پيشتاز,0.0116,فروسيليس‌ ايران‌,45495,10861153704,صندوق سرمایه گذاری مشترک پیشتاز,10320681523
FIN StichingDepositaryAmtelonForsatFund,0.0102,فروسيليس‌ ايران‌,51079,10861153704,FIN StichingDepositaryAmtelonForsatFund,10000000067
شركت داروسازي تهران شيمي-سهامي عام-,0.0836,مهندسي فيروزا,22596,10100477787,داروسازی تهران شیمی,10100348754
شركت توسعه معادن روي ايران-سهامي عام-,0.5185,فرآوري‌موادمعدني‌ايران‌,8115,10460091758,توسعه معادن روی ایران,10460063089
شركت سرمايه گذاري تجاري شستان-س.خ-,0.1538,فرآوري‌موادمعدني‌ايران‌,908,10460091758,سرمایه گذاری تجاری شستان,10103653560
شركت مديريت سرمايه آتيه خواهان-سهامي خاص-,0.034,فرآوري‌موادمعدني‌ايران‌,19316,10460091758,مدیریت سرمایه آتیه خواهان,10320380692
شركت سرمايه گذاري انديشه محوران-سهامي خاص-,0.011,فرآوري‌موادمعدني‌ايران‌,431,10460091758,سرمایه گذاری اندیشه محوران,10460064120
شركت توليدي چدن سازان-سهامي عام-,0.5672,غلتك سازان سپاهان,51788,10260496984,تولیدی چدن سازان,10260246993
BFMصندوق سرمايه گذاري.ا.ب.اكسيرسودا,0.0172,غلتك سازان سپاهان,51402,10260496984,صندوق سرمایه گذاری اختصاصی بازارگردانی اکسیرسودا,10000000030
صندوق سرمايه گذاري لوتوس پارسيان,0.0148,غلتك سازان سپاهان,21441,10260496984,صندوق سرمایه گذاری لوتوس پارسیان,10320823442
شركت سرمايه گذاري مديريت سرمايه مدار-سهامي عام,0.0135,غلتك سازان سپاهان,51872,10260496984,سرمایه گذاری مدیریت سرمایه مدار,10100401610
شركت بيمه كارآفرين,0.0109,غلتك سازان سپاهان,298,10260496984,بیمه کارآفرین,10102425969
شركت فرآوري معدني اپال كاني پارس-سهامي خاص-,0.6877,پارس فولاد سبزوار,70288,14005024571,فرآوری معدنی اپال کانی پارس,10103210000
سازمان توسعه ونوسازي معادن وصنايع معدني ايران,0.0752,پارس فولاد سبزوار,104,14005024571,سازمان توسعه و نوسازی معادن و صنایع معدنی ایران,10102158022
موسسه صندوق حمايت وبازنشستگي كارك.فولاد,0.0747,پارس فولاد سبزوار,22061,14005024571,صندوق حمایت وبازنشستگی کارکنان فولاد,10100395131
BFMصندوق.س.ا.بازارگرداني اميدلوتوس پارسيان,0.0535,پارس فولاد سبزوار,42238,14005024571,صندوق سرمایه گذاری اختصاصی بازارگردانی امیدلوتوس پارسیان,10000000055
صندوق سرمايه گذاري لوتوس پارسيان,0.0146,پارس فولاد سبزوار,21441,14005024571,صندوق سرمایه گذاری لوتوس پارسیان,10320823442
شركت سرمايه گذاري پارسيان-سهامي خاص-,0.0116,پارس فولاد سبزوار,443,14005024571,سرمایه گذاری پارسیان,10102671483
بنيادمستضعفان انقلاب اسلامي,0.9999,مالي و سرمايه گذاري سينا,86,10340058917,بنیاد مستضعفان انقلاب اسلامی,10100171920
شركت سرمايه گذاري آتيه صبا-سهامي خاص-,0.1295,فرآورده‌هاي‌ تزريقي‌ ايران‌,788,10100277750,سرمایه گذاری آتیه صبا,10103137408
موسسه صندوق بيمه اجتماعي روستائيان وعشاير,0.0506,فرآورده‌هاي‌ تزريقي‌ ايران‌,771,10100277750,مؤسسه صندوق بیمه اجتماعی روستاییان و عشایر,10100625070
شركت سرمايه گذاري داروئي تامين-سهامي عام-,0.0441,فرآورده‌هاي‌ تزريقي‌ ايران‌,48269,10100277750,سرمایه گذاری دارویی تامین,10102543204
شركت سرمايه گذاري تجاري شستان-س.خ-,0.9992,فولاد توان آور آسيا,908,10101134744,سرمایه گذاری تجاری شستان,10103653560
شركت صباميهن-سهامي خاص-,0.1214,فولاد كاويان,48312,10860704330,صبا میهن,10101997560
شركت گسترش كشاورزي ودامپروري فردوس پارس-س.خ-,0.4434,كشت و دام قيام اصفهان,42065,10260314217,گسترش کشاورزی و دامپروری فردوس پارس,10760094603
بنيادمستضعفان انقلاب اسلامي,0.3387,كشت و دام قيام اصفهان,86,10260314217,بنیاد مستضعفان انقلاب اسلامی,10100171920
BFMصندوق سرمايه گذاري.ا.ب.سينابهگزين,0.0152,كشت و دام قيام اصفهان,50192,10260314217,صندوق سرمایه گذاری اختصاصی بازارگردانی سینا بهگزین,10000000040
شركت پديده شيمي پايدار-سهامي خاص-,0.5667,پديده شيمي قرن,60440,10320217477,پدیده شیمی پایدار,10102924142
شركت واسط مالي آبان دوم-بامسئوليت محدود-,0.146,پديده شيمي قرن,77158,10320217477,واسط مالی آبان دوم,14004751723
شركت مديريت سرمايه پديده پايدار-سهامي خاص-,0.0293,پديده شيمي قرن,62650,10320217477,مدیریت سرمایه پدیده پایدار,14008885995
شركت بيمه مركزي جمهوري اسلامي ايران,0.0195,پديده شيمي قرن,21614,10320217477,بیمه مرکزی جمهوری اسلامی ایران,14001907528
شركت صنعتي مينو-سهامي عام-,0.8476,قاسم ايران,21451,10100984757,صنعتی مینو,10460002140
شركت سرمايه گذاري صنايع پتروشيمي-سهامي عام-,0.4347,گازلوله‌,46165,10101701799,سرمایه گذاری صنایع پتروشیمی,10101336320
شركت توسعه صنايع بهشهر-سهامي عام-,0.5047,‌گروه‌صنايع‌بهشهرايران‌,1032,10101662543,توسعه صنایع بهشهر,10100539090
شركت سرمايه گذاري آتيه صبا-سهامي خاص-,0.2613,‌گروه‌صنايع‌بهشهرايران‌,788,10101662543,سرمایه گذاری آتیه صبا,10103137408
BFMصندوق سرمايه گذاري.ا.ب.گروه توسعه بهشهر,0.0283,‌گروه‌صنايع‌بهشهرايران‌,22860,10101662543,صندوق سرمایه گذاری اختصاصی بازارگردانی گروه توسعه بهشهر,10000000041
شركت صنعتي آردزر-سهامي خاص-,0.195,گلوكوزان‌,70122,10861655731,صنعتی آرد زر,10101487029
شركت توسعه صنعتي غذايي زر-سهامي عام-,0.1439,گلوكوزان‌,50850,10861655731,توسعه صنعتی غذایی زر,14005705470
شركت خورشيدتجارت البرز-سهامي خاص-,0.0213,گلوكوزان‌,71286,10861655731,خورشید تجارت البرز,14002039462
صندوق سرمايه گذاري بادرآمدثابت كاردان,0.0196,گلوكوزان‌,41865,10861655731,با درآمد ثابت کاردان,14004684611
شركت صنعتي زرماكارون-سهامي خاص-,0.016,گلوكوزان‌,51637,10861655731,صنعتی زر ماکارون,10100047773
شركت توسعه صنعت كيميازر-سهامي عام-,0.0118,گلوكوزان‌,62857,10861655731,توسعه صنعت کیمیا زر,14006430670
"موسسه صندوق بازنشستگي،وظيفه،ازكارافتادگي وپ",0.2138,سرمايه‌گذاري‌غدير(هلدينگ‌,7638,10101306234,مؤسسه صندوق بازنشستگی وظیفه از کار افتادگی و پس انداز کارکنان بانکهای ملی و ادغام شده,10103037570
صندوق بازنشستگي نيروهاي مسلح,0.188,سرمايه‌گذاري‌غدير(هلدينگ‌,734,10101306234,مؤسسه صندوق بازنشستگی نیروهای مسلح,14006945954
شركت سرمايه گذاري تجاري شستان-س.خ-,0.0575,سرمايه‌گذاري‌غدير(هلدينگ‌,908,10101306234,سرمایه گذاری تجاری شستان,10103653560
شركت گروه توسعه مالي مهرآيندگان-سهامي عام-,0.0469,سرمايه‌گذاري‌غدير(هلدينگ‌,21630,10101306234,گروه توسعه مالی مهر آیندگان,10101638604
موسسه صندوق بيمه اجتماعي روستائيان وعشاير,0.0437,سرمايه‌گذاري‌غدير(هلدينگ‌,771,10101306234,مؤسسه صندوق بیمه اجتماعی روستاییان و عشایر,10100625070
صندوق بيمه عمروحوادث نيروهاي مسلح,0.0188,سرمايه‌گذاري‌غدير(هلدينگ‌,50079,10101306234,صندوق بيمه عمر و حوادث نيروهاي مسلح,10000000096
شركت توسعه ومديريت سرمايه صبا-سهامي خاص-,0.0154,سرمايه‌گذاري‌غدير(هلدينگ‌,22650,10101306234,توسعه و مدیریت سرمایه صبا,14003923256
شركت واسط مالي اسفنديكم-بامسئوليت محدود-,0.0145,سرمايه‌گذاري‌غدير(هلدينگ‌,41685,10101306234,واسط مالی اسفند یکم,14003755584
شركت بيمه كوثر-سهامي عام-,0.0124,سرمايه‌گذاري‌غدير(هلدينگ‌,19485,10101306234,بیمه کوثر,10320357598
شركت واسط مالي مهرپنجم-بامسئوليت محدود-,0.0108,سرمايه‌گذاري‌غدير(هلدينگ‌,70213,10101306234,واسط مالی مهر پنجم,14009747890
شركت سرمايه گذاري صنايع عمومي تامين-سهامي خاص-,0.6666,كشت و دام گلدشت نمونه اصفهان,20157,10260371718,سرمایه گذاری صنایع عمومی تامین,10102585130
BFMصندوق.س.ا.ب.صباگسترنفت وگازتامين,0.0204,كشت و دام گلدشت نمونه اصفهان,50909,10260371718,صندوق سرمایه گذاری اختصاصی بازارگردانی صبا گستر نفت و گاز تامین,10000000054
شركت سرمايه گذاري برق وانرژي غدير-سهامي خاص-,0.51,توسعه مسير برق گيلان,50141,10320476535,سرمایه گذاری برق و انرژی غدیر,10320660538
شركت سرمايه گذاري اهداف-سهامي عام-,0.224,توسعه مسير برق گيلان,20062,10320476535,سرمایه گذاری اهداف,10103808813
شركت مديريت انرژي اميدتابان هور-سهامي عام-,0.2001,توسعه مسير برق گيلان,50139,10320476535,مدیریت انرژی امید تابان هور,10320688781
شركت سرمايه گذاري زرين پرشيا-سهامي خاص-,0.0177,توسعه مسير برق گيلان,25031,10320476535,سرمایه گذاری زرین پرشیا,10102986880
شركت پاياسامان پارس-سهامي خاص-,0.5099,جنرال مكانيك,51583,10260170431,پایاسامان جنوب,10420252832
بنيادمستضعفان انقلاب اسلامي,0.3441,جنرال مكانيك,86,10260170431,بنیاد مستضعفان انقلاب اسلامی,10100171920
BFMصندوق سرمايه گذاري.ا.ب.سينابهگزين,0.0113,جنرال مكانيك,50192,10260170431,صندوق سرمایه گذاری اختصاصی بازارگردانی سینا بهگزین,10000000040
شركت مادرتخصصي گسترش صنايع غذايي سينا-سهامي خا,0.4894,قنداصفهان‌,1061,10100297496,مادر تخصصی گسترش صنایع غذایی سینا,10104055685
بنيادمستضعفان انقلاب اسلامي,0.2204,قنداصفهان‌,86,10100297496,بنیاد مستضعفان انقلاب اسلامی,10100171920
شركت سرمايه گذاري نيرو-سهامي عام-,0.0113,قنداصفهان‌,535,10100297496,سرمایه گذاری نیرو,10101659507
